,cate,course_code,entity_id,title
0,[u'GIT'],gitusers,345,Git for Users
1,[u'Oracle'],453,453,Oracle: (1ZO-147) Program with PLSQL
2,"[u'CSS', u'Web Development', u'Computer Graphics']",css3int,3465,Introduction to CSS3
3,"[u'Linux', u'Ubuntu']",ubtdt,300,Ubuntu Desktop
4,[u'Android'],androidtest,367,Android Applications Testing
5,[u'Blockchain'],blockchain,153393,Blockchain - Theory and Practice
6,[u'Soft Skills'],timeds,191125,Time Management
7,"[u'BPM', u'BPMN', u'OCEB']",oceb2f100-1,114882,OCEB2 OMG Certified Expert in BPM - Fundamental Exam Preparation (5 days)
8,[],oracleebsfundamentals,207149,Oracle E-Business Suite Fundamentals
9,[u'Finance'],cbpst,23716,"Corporate Banking:  Products, Strategies and Trends"
10,"[u'TestNG', u'Test Automation', u'Automation Testing']",testng,141125,Testing with TestNG
11,"[u'C#', u'C Language', u'Microsoft .NET', u'C-sharp', u'Cross Platform Development', u'Visual Studio', u'Developer']",advancedcsharp,200408,Advanced Programming in C#
12,"[u'Test Automation', u'Automation Testing', u'JMeter']",jmeterfun,245,JMeter Fundamentals
13,"[u'Neural Networks', u'Business Rules', u'Machine Learning', u'Artificial Intelligence']",aiauto,153856,Artificial Intelligence in Automotive
14,"[u'digital marketing', u'Social Media']",digimarketing,205385,Digital Marketing
15,[u'Management'],comawa,2943,Commercial Awareness
16,"[u'HTML', u'Drupal']",drupalseo,332,Drupal SEO
17,[],mcsawin8,113899,4.- MEJORA TUS HABILIDADES PARA MCSA WINDOWS 8
18,"[u'Business', u'Hadoop', u'Big Data', u'Business Analysis']",hadoopba,113243,Hadoop for Business Analysts
19,"[u'Performance', u'Java']",javaperf,302,Java Performance 
20,[],Semwebbe,209141,Bespoke Semantic Web Training Course
21,"[u'JavaScript', u'Microsoft Authorised']",ms-20482,68895,MS-20482 Advanced Windows Store App Development using HTML5 and JavaScript MTA Exam  70-482
22,[u'Test Automation'],TestComplete,209385,TestComplete
23,[u'Node.js'],nodejspm2,116050,Node.js and PM2
24,[u'Assertiveness'],862,862,Building an Effective Team with Belbin Team Roles
25,[u'TensorFlow'],tfir,134789,TensorFlow for Image Recognition
26,[u'MATLAB'],simulinkadv,198633,Simulink® for Automotive System Design Advanced Level
27,[],Chefad,201289,Chef Advanced
28,"[u'Red Hat', u'Debian', u'Cloud Computing', u'Linux', u'Ubuntu']",lcsmcentos,90034,Linux Cluster and Storage Management on CentOS 6 & 7
29,"[u'Web Development', u'PHP', u'Web application framework']",laravel,202128,Laravel: Build rapid and elegant web applications with the Laravel PHP Framework
30,[u'MATLAB'],ecmloct,67597,Evolutionary computation with MATLAB/OCTAVE
31,"[u'Android', u'Mobile Programming', u'iOS', u'Cross Platform Development', u'Mobile Development']",mobdevdm,4,Mobile Development - An Overview for Decision Makers
32,"[u'Software Engineering', u'MBSE', u'SysML', u'UML']",sysengsysmluml2,96724,System Engineering using SysML and UML 2
33,[u'OCRES'],ocres200,390,OMG Certified Real-time and Embedded Specialist (OCRES) - Intermediate Exam Preparation
34,"[u'Functional programming', u'Java', u'Programming']",scalaadvancedfunctional,208841,Scala: Advanced functional programming
35,"[u'SQL Server BI', u'Access', u'Data Mining', u'Data Visualization', u'Excel']",PowerBIPL,199449,Analiza danych z zastosowaniem Power BI
36,"[u'Statistics', u'Six Sigma']",sixsigmagbfast,207649,Six Sigma Green Belt - Fast Track
37,"[u'Brand Management', u'Marketing']",b2bbrandman,338,B2B Brand Management
38,[],MOS112,191921,Advanced C++ Software Design
39,[u'Requirements Engineering'],piwa,8558,Podstawy inżynierii wymagań i analizy
40,[u'Statistics'],stats1,309,Statistics Level 1
41,[u'Parallel Computing'],openmpi,209529,Open MPI: Building distributed memory applications
42,"[u'PowerPoint', u'Microsoft Office', u'Excel']",bexppt,153337,Practical MS Excel and PowerPoint
43,[],siebelscripting,207121,Siebel for Developers: Scripting
44,[u'Secure Code'],cl-osc,155025,The Secure Coding Landscape
45,"[u'Pentaho', u'Data Mining', u'Big Data', u'Data Analysis', u'Business Intelligence']",PentahoDI,209137,Pentaho Data Integration Fundamentals
46,"[u'Java EE', u'Tomcat']",atomjeeadm,2387,Apache Tomcat and Java EE Administration
47,"[u'Data Mining', u'Data Visualization']",datavis1,143833,Data Visualization
48,[u'MATLAB'],simwcs,116058,Simulation of Wireless Communications Systems using MATLAB
49,[u'MATLAB'],ipmat1,145969,Introduction to Image Processing using Matlab
50,[],structuralengineering,208717,Introduction to Structural Engineering
51,[u'Soft Skills'],custds,191117,Excellent Customer Service 
52,[u'Data Mining'],pmml,68680,Predictive Models with PMML
53,"[u'Kubernetes', u'Docker']",dockkuber,206701,Kubernetes - Advanced
54,[u'Ansible'],advans,134929,Advanced Automation with Ansible
55,"[u'TensorFlow', u'NLP']",tsflw2v,141181,Natural Language Processing with TensorFlow
56,[],ADSQL,130149,SQL Advanced
57,"[u'Scrum', u'Agile', u'Project Management', u'Technologies Overview']",scrummanexec,325,Scrum for Managers and Executives
58,"[u'Statistics', u'Data Mining', u'Business Analysis']",datama,99817,Data Mining and Analysis 
59,[u'Business Analysis'],badsp,530,Introduction to Business Analysis: Defining Successful Projects
60,"[u'RSpec', u'Ruby', u'Software Testing']",rspectest,94309,Testing Ruby applications with RSpec
61,[],sapabap,155789,SAP Advanced Business Application Programming (ABAP) 
62,[],itilso,68487,ITIL®: Intermediate Lifecycle Stream: Service Operation (SO)
63,"[u'Dashboard', u'Elasticsearch']",kibana,207517,Kibana: Essentials
64,[u'Soft Skills'],3108,3108,Psychology of interpersonal cooperation
65,[u'Node.js'],nodejspm2web,135069,Node.js Working with PM2 & WebStorm
66,[u'Computer Graphics'],3032,3032,Design and Composition in Photography
67,"[u'SOA', u'Web Services']",wsbnp,3800,Web Services Basics for Non-Programmers
68,"[u'BPMN', u'Business Analysis']",bpmna,3140,BPMN for Analysts
69,"[u'Microsoft Office', u'Excel']",3024,3024,Working with spreadsheet in Microsoft Excel
70,[u'Oracle'],373,373,Oracle Database 11g: New Features for Administrators DBA Release 2
71,"[u'Professional Development', u'Management']",presconf,531,Presenting with Confidence
72,[],AMOS11,191925,Introduction to ARM Cortex M Architecture
73,"[u'VBA', u'Excel VBA', u'Excel']",3089,3089,Visual Basic for Applications (VBA) in Excel (intermediate level)
74,[u'Symfony'],sym2propel,192776,Symfony2 - framework klasy enterprise
75,"[u'SOA', u'SOA Governance', u'SoaML', u'SOA ESB Integration']",soaarch01,68725,SOA Architect
76,"[u'BDD', u'Agile', u'Software Testing']",bddfornonprogrammers,207441,BDD for Non-Programmers: Live workshop
77,[u'LMS'],moodleinstructor,208725,"Moodle for Instructors, Trainers, and Course Creators"
78,"[u'VBA', u'Excel VBA', u'Excel']",excelvbai,241,Excel VBA Introduction
79,[u'Impala'],Imp,132220,Impala for Business Intelligence
80,[u'Real Time Services over IP'],siptel,3703,Practical SIP Telephony
81,"[u'Soft Skills', u'Management']",809,809,Introduction to Lean Six Sigma green belt 
82,"[u'Linux', u'Samba', u'Directory Services', u'Ubuntu']",sambadv,142893,Samba 
83,"[u'Adobe', u'Photoshop', u'Computer Graphics']",3626,3626,Adobe Photoshop Elements
84,[u'Java'],javaadvanced,143204,Java Advanced - one day
85,[u'RPA'],rpaimplementing,207665,RPA: Implementing Robotic Process Automation
86,"[u'JavaScript', u'Node.js', u'Programming']",nodejs,3815,Node.js
87,[],Leader,203797,Leadership
88,"[u'SOA', u'XML']",soaovv,98101,SOA Overview
89,"[u'Oracle', u'PL/SQL']",3410,3410,Oracle 11g - Programming with PL / SQL I - Workshops
90,"[u'Microsoft Office', u'Excel']",ExcelAdv,3034,Excel Advanced
91,"[u'IoT', u'Data Mining', u'Big Data', u'Computer']",bdbiga,23436,Big Data Business Intelligence for Govt. Agencies
92,"[u'Strategic Management', u'Strategic Planning', u'NHS']",stratplanNHS,200453,Strategic Planning National Health Service NHS
93,"[u'Soft Skills', u'Management']",traintrainer,532,Train-the-Trainer
94,"[u'Scrum', u'Agile', u'Project Management']",scrumstep,716,Scrum - Step by Step
95,[u'SOA'],soabusi,272,SOA: the Business View
96,"[u'Person To Person Skills', u'Working In A Team', u'Management', u'Professional Development', u'Assertiveness', u'Human Resources']",Influence,199741,Influence in Action
97,"[u'Node.js', u'Express', u'AngularJS', u'Angular', u'MEAN Stack', u'MongoDB', u'JavaScript', u'Web Development']",mean2,205773,Building Web Apps using the MEAN stack - Bespoke
98,"[u'JavaScript', u'Web Development', u'Ajax', u'Java']",gwt,209012,"GWT: Write Ajax web applications in Java, deploy as Javascript"
99,[u'Human Resources'],hip,507,High Impact Presentations
100,[u'Rust'],rust3d,199865,Rust Language
101,"[u'Mobile Programming', u'Android', u'Cross Platform Development', u'Mobile Development', u'JavaScript', u'iOS']",ionic1angular1,208705,Ionic1: Build a mobile app with Ionic 1 and Angular 1
102,[],SocAcc,203813,Social Accountability
103,"[u'Soft Skills', u'Management']",rcefec,99898,Reclutamiento y  Contratacion Efectiva
104,"[u'AWS', u'Cloud Computing']",awspaas,202964,AWS: A hands-on introduction to cloud computing
105,[],soasoagovernance,152861,SOA and SOA Governance
106,"[u'MSSQL', u'SQL']",6552,6552,Administracja bazą danych Microsoft SQL Server 2012
107,"[u'Enterprise Architecture', u'Web Services', u'XML']",soastm,5078,"Service-Oriented Architecture: Strategy, Technology and Methodology"
108,"[u'MATLAB', u'Programming']",matlabprog,2842,MATLAB Programming
109,"[u'GlassFish', u'Java EE', u'Java']",gfadm,3249,GlassFish Administration
110,[u'C-sharp'],pamvc5,356,Programming in ASP.NET MVC 5
111,"[u'Database', u'VBA', u'Excel']",3165,3165,Visual Basic for Applications (VBA) and Databases
112,"[u'Business Motivation Model', u'Agile', u'Technologies Overview', u'Business Analysis']",eaptogafc,96709,Adapting Business Capabilities and 'Value Propositions' to Changes 
113,"[u'Android', u'Mobile Programming', u'React', u'iOS', u'Cross Platform Development']",reactnativeexpo,205437,React Native Expo: simplifying the creation and deployment of your React Native application
114,[u'Quality Engineering'],zconfz,8973,Zarządzanie konfiguracją i zmianami
115,[u'Wireshark'],nettbswsadv,94281,Advanced Network Troubleshooting Using Wireshark
116,"[u'Scrum', u'Agile']",scrumtrintro,861,An Introduction to the Scrum Team Role
117,[u'Requirements Engineering'],mwpm,8970,Modelowanie wymagań – przegląd metod
118,"[u'Strategic Management', u'Advertising', u'Brand Management', u'Marketing']",myccmr,114606,"Marketing for your company: Understand customer, do marketing right"
119,[u'Java'],javaprog,3058,Java Programming
120,"[u'Embedded Linux', u'Linux', u'Embedded Systems']",elnxint,100110,Introduction to Embedded Linux (Hands-on training)
121,[],bspkrintro,98128,R Fundamentals
122,"[u'BDD', u'Automation Testing', u'Software Testing', u'Requirements Engineering', u'Test Automation', u'Agile', u'Web Application Testing', u'Web Development', u'Java']",jbehave,209625,JBehave: BDD with Java
123,"[u'Game Development', u'Mobile Programming', u'Cross Platform Development', u'Corona']",appcorona,97443,App programming for Mobile devices using the Corona SDK
124,"[u'JBoss', u'Business Rules', u'Jboss Rules', u'Drools']",droolsdslba,113802,Drools 6 and DSL for Business Analysts
125,"[u'Enterprise Architecture', u'DoDAF']",dodafint,435,Department of Defense Architecture Framework (DoDAF) Overview
126,[u'Assertiveness'],313,313,Springboard Women Development Programme
127,"[u'Person To Person Skills', u'Soft Skills', u'Mentoring', u'Coaching', u'Management', u'Great Communicator']",xyz,202137,Róznice pokoleniowe w zarządzaniu. Pracownicy pokoleń XYZ. Jak z nimi funkcjonować
128,[u'Drupal'],drupalviews,637,Drupal Views Module
129,"[u'BPM', u'BPMN', u'BPMS', u'Business Analysis']",ubpmbpmn2,153065,Understanding Business Process Modeling with BPMN 2.0
130,"[u'Statistics', u'Data Visualization', u'R', u'Python', u'Big Data', u'Data Analysis', u'Data Mining']",BigData,199416,Introduction to Data Analysis and Big Data
131,[],itilst,68486,ITIL®: Intermediate Lifecycle Stream: Service Transition (ST)
132,"[u'RPA', u'Microsoft .NET']",UiPath,208333,UIPath: Deploying a Robotic Workforce
133,[u'Oracle'],471,471,Oracle Database 11g: SQL Fundamentals I (IZO-051)
134,"[u'Apache Spark', u'Business Intelligence', u'Apache', u'Big Data', u'Hadoop', u'Data Mining']",sparkhadoop,201373,Handle Big Data with Apache Spark and Hadoop
135,[u'Secure Code'],cl-csc,154749,C/C++ Secure Coding
136,"[u'Test Automation', u'Web Application Testing', u'Automation Testing', u'Software Testing']",tosca,204993,Tosca: Model-based testing for complex systems
137,[u'Test Automation'],intrautes,192509,Introduction to Automated Testing
138,[u'Data Network'],datacomnet,94282,Data Communications Networks - Theory and Practice
139,"[u'MariaDB', u'Database', u'SQL', u'MySQL']",mariadbadmin,398,MariaDB Database Administration
140,[u'Soft Skills'],kulti,143065,Różnice międzykulturowe w pracy zespołowej
141,"[u'Project Management', u'Excel']",ExPrVisP,199201,Excel - Wizualizacja postępu prac projektowych
142,[],FoodS,203829,Food safety standards
143,[],sqlvbanonit,192865,SQL For Beginner + VBA Basics
144,"[u'Hadoop', u'Big Data', u'NoSQL']",voldemort,201556,Voldemort: Setting up a key-value distributed data store
145,"[u'Scrum', u'Agile', u'Project Management']",agilepz,95346,Agile w projektach zdalnych
146,"[u'LXC', u'Virtualization']",lxcintro,113858,Introduction to Linux Containers (LXC)
147,[u'Soft Skills'],2899,2899,Effective communication skills 
148,"[u'Data Mining', u'Big Data', u'Artificial Intelligence']",datamin,66209,Data Mining
149,"[u'JavaScript', u'Programming']",jvbsc,201593,Javascript Basics
150,"[u'Web Development', u'Web application framework', u'Java']",springboot,203204,Spring Boot: Rapidly build Spring-based web applications
151,"[u'Scrum', u'Strategic Management', u'Risk Management', u'Management', u'Agile', u'Project Management']",pazzitsa,8975,Psychologiczne aspekty zarządzania zespołem IT – psychologia zespołu Scrum agile
152,"[u'event stream processing', u'Big Data', u'Stream processing']",samza,209481,Samza for stream processing
153,"[u'Internet Security', u'Hands on Security']",pkiimpman,94166,PKI: Implement and Manage
154,"[u'MediaWiki', u'Wiki', u'Wikipedia']",wikiedit,352,Wikipedia for Editors
155,"[u'IP Security', u'Cisco Security']",wciosd,3756,Workshop for Cisco IOS Devices Implementing IPSec using Certificate Authentication via a Windows 2008 R2 CA
156,"[u'Database', u'MySQL']",zamysql,23214,Zaawansowana administracja MySQL
157,[u'Statistics'],mtstatda,318,Minitab for Statistical Data Analysis
158,"[u'MATLAB', u'Data Mining', u'Big Data']",matlab2,97449,MATLAB Fundamentals
159,[u'Agile'],agilesofttest2,115015,持续集成理论、原则与实践
160,"[u'MSSQL', u'Database', u'Programming', u'Oracle', u'SQL']",rekit,203937,Szkolenie dla rekruterów IT - programowanie?
161,[u'Drupal'],webappd7,366,"Building Web Applications with Drupal 7, Views, Fields and Panels"
162,"[u'Android', u'Augmented Reality']",rraram,97766,Rzeczywistość rozszerzona (Augmented Reality - AR) w aplikacjach mobilnych
163,"[u'Brand Management', u'Change Management', u'Management']",DivInc,191905,Diversity and Inclusion Training 
164,"[u'Data Visualization', u'Data science', u'Big Data', u'Data Analysis', u'Business Intelligence']",zeppelin,209477,Zeppelin for interactive data analytics
165,[],oostor,201153,Manage data and information with the Object Storage
166,[u'Bio'],bioinfbas,396,Basics of Bioinformatics
167,"[u'Big Data', u'NoSQL']",bigdatastore,113105,Big Data Storage Solution - NoSQL
168,"[u'Embedded Linux', u'Linux', u'Cross-platform development']",ldd,202685,Embedded GNU/Linux Kernel Internals and Device Drivers
169,"[u'Inkscape', u'Computer Graphics']",inkscape,741,Inkscape
170,[u'UML'],umlocl1,97136,UML OCL
171,"[u'Virtualization', u'Docker']",dockeradm2,208549,Docker for Developers and System Administrators - Bespoke
172,[],custocassan,198981, Cassandra Customized training
173,"[u'Statistics', u'Bio']",statsres,376,Statistics for Researchers
174,[u'Blockchain'],blockchainenm,192437,Blockchain for Entrepeneurs and Managers
175,[u'Soft Skills'],812,812,New Supervisor Training
176,[u'Apache Camel'],apachecamel,89818,Apache Camel
177,"[u'SQL', u'Oracle', u'PL/SQL']",SQL12c1,155197,Oracle 12c – wprowadzenie do języka SQL
178,[],intrpr,201217,Introduction to Machine Learning and Deep Learning with Python and R
179,[u'Oracle'],66538,66538,Build applications with Oracle Application Express (APEX)
180,"[u'Swift', u'iOS', u'Programming']",ios8xcode6devs,74886,iPhone and iPad Development in Swift for iOS 8 and Xcode 6
181,[u'Java EE'],OpenSearchServer,209073,OpenSearchServer
182,"[u'XQuery', u'eXist-db']",existdb,8,eXist-db Development and Performance
183,"[u'Business Rules', u'Artificial Intelligence']",manbrphp,68366,Managing Business Rules with PHP Business Rules
184,"[u'IIS', u'Microsoft .NET', u'Web Server']",iis8aspadm,95106,IIS 8 and ASP.NET Administration
185,"[u'Enterprise Architecture', u'MODAF']",modafint,434,MOD Architecture Framework (MODAF) Overview
186,"[u'C-sharp', u'Python', u'C#', u'Programming', u'JavaScript', u'Java']",3627,3627,Introduction to Programming
187,"[u'SQL', u'Oracle', u'PL/SQL']",SQL_AN2,155193,Oracle 12c – Język SQL dla analityków II - warsztaty
188,"[u'BPM', u'BPMN', u'BPMS', u'Business Analysis', u'Activiti']",activitidev,99511,Activiti for Process Developers
189,"[u'Internet Security', u'Hands on Security']",ccsk,94170,CCSK - Certificate of Cloud Security Knowledge - Plus
190,"[u'Embedded Linux', u'Linux', u'Cross Platform Development', u'Embedded Systems']",elkdd,100117,Embedded Linux Kernel and Driver Development 
191,"[u'Statistics', u'R']",rdataana,6,R for Data Analysis and Research 
192,"[u'Responsive Design', u'Web Design']",foundation,209069,Foundation responsive front-end framework
193,[u'Embedded Systems'],rtos,197757,Real Time Operating System
194,"[u'Adobe', u'InDesign']",aidsg,3084,Adobe InDesign
195,"[u'Image Analysis', u'Deep Learning', u'Artificial Intelligence']",PaddlePaddle,209125,PaddlePaddle
196,"[u'Assertiveness', u'Soft Skills', u'Management']",66278,66278,Bezstresowe zarządzanie sobą w czasie - jak mieć zawsze określone cele i być efektywnym w ich realizacji.
197,"[u'Microsoft Office', u'Word']",3052,3052,MS Word Basic
198,"[u'TCP/IP Networking', u'Linux']",dnsandbind,202028,"DNS and BIND: Setting up, managing, and securing your DNS server"
199,[],intramart,207373,Intramart: Implementing JavaEE Business Web Applications
200,"[u'Hadoop', u'Stream processing']",tigon,209657,Tigon: Real-time streaming for the real world
201,"[u'C-sharp', u'Microsoft .NET']",wfcsn,447,Windows Forms with C#.Net
202,[u'FUML'],fumlintro,432,Introduction to FUML
203,"[u'BDD', u'Automation Testing', u'Software Testing', u'Selenium', u'Test Automation', u'Web Application Testing', u'Java']",cucumberjava,209641,Cucumber: Implementing BDD with Java
204,[u'Drupal'],drupal8webapp,286,"Building Web Applications with Drupal 8, Views, Fields and Panels"
205,"[u'C-sharp', u'Microsoft .NET']",820,820,ADO.NET 4.0 Development
206,"[u'Test Automation', u'Agile', u'Software Testing']",agilecat,2949,Certified Agile Tester
207,[],bspsalt,201533,Bespoke 2 day Saltstack
208,"[u'BPM', u'BPMN', u'BPMS', u'Automated Business Process Discovery (ABPD)', u'Business Analysis', u'Data Mining']",processmining,200312,Process Mining
209,"[u'Design Patterns', u'Business Analysis']",oobdp,96722,Object Oriented Design using Design Patterns
210,"[u'XQuery', u'eXist-db']",existdbint,9,eXist-db Introduction
211,"[u'MongoDB', u'NoSQL']",mongodbau,98157,MongoDB for Advanced Users
212,"[u'C-sharp', u'C#', u'Microsoft .NET', u'Programming']",pjcs,66242,Programming in C#
213,[u'Nagios'],nagioscore,68550,Nagios Core
214,[u'Soft Skills'],motivds,191113,Motivating Employees 
215,[u'Adobe'],3035,3035,Adobe Flash Basic
216,"[u'Statistics', u'Six Sigma']",sixsigmabbfast,207653,Six Sigma Black Belt - Fast Track
217,[u'Train The Trainer'],12,97968,Innovation in training
218,[u'Microsoft Authorised'],ms-40363,68859,MS-40363 Web Development Fundamentals MTA Exam 98-363
219,"[u'Cloud Computing', u'IaaS']",softlayer,146337,SoftLayer API Fundamentals
220,[u'Linux'],linuxnetsec,3068,Network Security in Linux
221,"[u'Scrum', u'KanBan', u'Agile']",safeTM03,117038,SAFe® 4.0 for Teams  (For onsite delivery as part of a real-world Agile Release Train)
222,[u'Soft Skills'],Negskills0017,209009,Negotiation Skills
223,[u'Risk Management'],lendapp,552,Lending Applications
224,[],dru8besp,208329,Drupal 8 Bespoke Training Course
225,"[u'Enterprise Architecture', u'Business Motivation Model', u'Agile', u'Technologies Overview', u'Business Analysis']",eaintro1,96708,Introduction to Enterprise Architectures
226,"[u'Quality Engineering', u'DevOps', u'Agile', u'Software Engineering', u'Jenkins']",jenkins,199469,Jenkins: Continuous integration for Agile development
227,[u'Secure Code'],cl-and,154993,Android Security
228,[u'Drupal'],drpal8views,246,Drupal 8 Views Module
229,"[u'Internet Security', u'Security Management']",pki,97463,Public Key Infrastructure
230,[u'Python'],pythfund,201269,Python Fundamentals
231,[u'Linux'],linuxadmfun,95089,Linux Administration Fundamentals
232,[u'Java'],javah,3061,Java Hibernate
233,"[u'Performance Testing', u'Web Application Testing', u'Software Testing']",8521,8521,Tester doskonały
234,"[u'Apache Spark', u'R', u'Python', u'Big Data', u'Data Analysis', u'Predictive Analytics', u'Neural Networks', u'Hadoop']",preddata,197885,Predictive Analytics & Big Data 
235,[u'OpenStack'],osai,97151,OpenStack Administration - Intermediate
236,"[u'Automation Testing', u'Software Testing', u'Selenium', u'Test Automation', u'Python', u'Selenium Webdriver', u'Web Application Testing']",seleniumpython,206313,Selenium with Python for test automation
237,"[u'Red Hat', u'Linux', u'SQL', u'MariaDB', u'Apache', u'Debian', u'Database', u'MySQL', u'Web Server', u'Ubuntu']",dnswebmaildb,90049,"Top 4 Linux/Unix Servers - DNS,Web,Mail and Database "
238,[],sapfscm,155785,SAP Financial Supply Chain Management (FSCM) 
239,"[u'Yocto Project', u'Embedded Linux', u'Linux', u'Systems Architecture', u'Cross-platform development']",eglisa,202681,Embedded GNU/Linux Systems Architecture
240,[],nagiosbspk,97456,Nagios
241,[u'Secure Code'],cl-sts,154893,Security Testing
242,[u'OCRES'],ocres300,391,OMG Certified Real-time and Embedded Specialist (OCRES) - Advanced Exam Preparation
243,[u'Advantage Digital'],advtemp,199493,Advantage Digital – Benefit Letter Templates
244,[u'Embedded Systems'],cembedd,197745,C Programming for Embedded Systems
245,[u'Android'],androidwidget,369,Android App Widgets Development
246,"[u'Web Development', u'Web Services', u'Web']",cmsjoomla,191137,CMS Joomla
247,[u'Linux'],3063,3063,Introduction to Linux
248,[u'Hadoop'],68737,68737,Hadoop for Data Analysts
249,"[u'MediaWiki', u'Wiki', u'Wikipedia']",mwedit1,2662,MediaWiki for Content Editors
250,[],advancedddd,209049,Advanced Domain Driven Design 
251,"[u'TCP/IP Networking', u'Cisco Security']",3712,3712,Cisco CCNA Syllabus in 5 Days
252,[],QMS,203789,ISO 9001 implementation
253,"[u'Information Security Risk', u'Internet Security']",pcbc,94171,PCBC - Practitioner Certificate in Business Continuity Management
254,[u'Programming'],2371,2371,CICS Command Level Programming
255,"[u'R', u'Data Mining', u'Big Data']",rprogda,114674,R Programming for Data Analysis
256,[u'SQL'],416,416,Introduction to Firebird
257,"[u'Corporate Compliance', u'Corporate Governance', u'Risk Management', u'Strategic Management', u'Management']",grmcfun,113157,"Governance, Risk Management & Compliance (GRC) Fundamentals"
258,[u'web2py'],web2py,135053,Web Development with Web2Py
259,"[u'OpenLDAP', u'Directory Services', u'LDAP']",oldaplnxsys,91453,OpenLDAP for Linux Systems
260,"[u'Performance Testing', u'Web Application Testing', u'Software Testing']",istqbTA,206425,ISTQB Test Analyst
261,[u'Soft Skills'],stakehol,199345,Stakeholder engagement and management –  budowanie systemu wsparcia dla projektu
262,[u'Performance Testing'],testistqb,8520,Kierownik testów ISTQB
263,"[u'Statistics', u'Data Visualization', u'R', u'Big Data', u'Data Analysis', u'Predictive Analytics', u'Data Mining']",kdd,200632,Knowledge Discover in Databases (KDD)
264,[u'MQL4'],mql4prog,430,MQL4 Programming
265,[],bspai,204597,Bespoke AI Talk
266,[u'Secure Code'],cl-vip,154989,Voice Over IP Security
267,"[u'MongoDB', u'NoSQL']",mongodbadmin,405,MongoDB for Administrators
268,"[u'Statistics', u'Quantitative Analytics']",descstats,95343,Descriptive Statistics
269,[u'Microsoft .NET'],corenet2dev,442,Core Foundations of .NET 2.0 Development
270,[u'Management Accounting'],pricestrat,385,A Practical Guide to Successful Pricing Strategies
271,[],bcne,154477,Basics of Computer Networks for engineer
272,"[u'Corporate Governance', u'Financial Crime']",amlctf,491,Anti-Money Laundering (AML) and Combating Terrorist Financing (CTF)
273,[u'Excel'],msexcelil,100069,MS Excel - Intermediate / Advanced level (customized)
274,[u'Magento'],magento,142965,Deploying Magento 2.1 for eCommerce
275,[u'XML'],msdxml,667,Modelowanie struktury dokumentu XML
276,"[u'Linux', u'Programming']",bashp1,3069,BASH Programming
277,"[u'Scrum', u'Agile', u'Project Management']",agiletest,152865,Rola testera w Agile
278,[],itilsoa,68491,ITIL®: Intermediate Capability Stream: Service Offerings & Agreements (SOA)
279,"[u'Database', u'SQL']",dbwarefund,146469,Data Warehousing Design Fundamentals 
280,"[u'Management', u'Microsoft Office', u'Business Analysis', u'Excel']",68615,68615,Microsoft Office Excel - moduł Business Intelligence
281,"[u'Data science', u'Machine Learning', u'Neural Networks', u'Artificial Intelligence', u'Deep Learning']",Fairseq,207853,Fairseq: Setting up a CNN-based machine translation system
