,cate,course_code,entity_id,title
282,"[u'Scrum', u'Agile']",scrumbelbintr,863,Building an Effective Scrum Team with Belbin Team Roles
283,[u'Data Network'],radioat,114915,Radio Access Technology from 2G to 4G
284,"[u'Software Engineering', u'DevOps', u'Developer', u'Docker']",dockerswarm,200657,Docker with Swarm
285,"[u'JavaScript', u'jQuery', u'AngularJS', u'Angular2']",webapp1,153457,Web Application Development
286,[],oracleap,141993,Oracle Apps Technical Online Training
287,[u'Bio'],mdlbiostruct,393,Modeling of Biological Structures
288,"[u'Database', u'Oracle', u'SQL']",osqlint,67603,Oracle SQL Intermediate
289,[u'Liferay'],liferaydev,98998,Liferay Development 
290,"[u'Database', u'Oracle', u'SQL']",3057,3057,Oracle SQL Language
291,"[u'Test Automation', u'Design Patterns', u'Software Testing', u'Property-based testing']",ScalaCheck,209393,ScalaCheck property-based testing
292,"[u'SOA', u'SoaML', u'Software Design', u'BPM', u'Business Analysis']",soadtbs,96723,Designing SOA using BPM and SoaML
293,"[u'Internet Security', u'Security Management']",cismp,94162,CISMP - Certificate in Information Security Management Principles
294,[u'Symfony'],symfewf,2880,Symfony2 - enterprise web framework
295,"[u'JBoss', u'Jboss Rules', u'jBPM', u'Drools']",droolsrlsadmscaling,207725,Drools Rules Administration and Scaling
296,"[u'Scribus', u'Computer Graphics']",sribcp,3172,Scribus - Composition of the publication
297,"[u'Database', u'Oracle', u'SQL']",3331,3331,Oracle 11g - Advanced data analysis - workshops
298,"[u'JavaScript', u'HTML5', u'Artificial Intelligence']",pghtml5js,67961,Programowanie gier w HTML5 i JavaScript
299,"[u'Finance', u'Management']",rcbd,535,Retail and Commercial Banking Delivery Channel Masterclass
300,"[u'Kubernetes', u'Virtualization', u'Docker']",dockerkubernetesscale,208021,Docker and Kubernetes: Building and scaling a containerized application
301,"[u'Database', u'Oracle', u'SQL']",3319,3319,Data Analysis with Oracle 11g - workshop
302,"[u'Functional programming', u'Programming']",clojure,209533,Clojure: A practical introduction to functional programming
303,"[u'Node.js', u'Express', u'AngularJS', u'Angular', u'MEAN Stack', u'MongoDB', u'JavaScript']",meanangular2,207913,Angular 2: Building Web Apps using the MEAN stack
304,[],ClientM,203805,Client management
305,[u'Test Automation'],WinRunner,209389,WinRunner
306,"[u'Programming', u'XML']",pcxmlsoap,98997,"Programming Concepts, XML and SOAP"
307,"[u'Distributed Applications', u'Docker', u'Software Architecture']",dcos,201877,DC/OS: Turn 1000 machines into a single logical computer
308,"[u'Corporate Governance', u'Soft Skills', u'Management']",intrcgov,99481,Integrated Risk & Corporate Governance
309,"[u'AngularJS', u'Angular', u'Angular2', u'Software Testing']",angulartesting,209033,Angular: Testing your Angular applications
310,"[u'TCP/IP Networking', u'IP Security', u'Real Time Services over IP']",ipintro,141113,Wprowadzenie do IP
311,"[u'Data Mining', u'Pentaho', u'Business Intelligence']",pdi2,207021,Pentaho Data Integration (PDI) - moduł do przetwarzania danych ETL (poziom średniozaawansowany)
312,"[u'KanBan', u'Agile']",agilekanbanlean,114715,Managing Agile Projects with Lean and Kanban
313,"[u'Android', u'Cross Platform Development']",androidct,400,Cross Train to Android
314,"[u'Distributed Applications', u'Cloud Computing', u'Virtualization']",coreos,202200,Container Linux: Deploy and monitor containerized applications at scale
315,"[u'JavaScript', u'Microsoft Authorised']",ms-20480,68879,MS-20480 Programming in HTML5 with JavaScript and CSS3 MTA Exam 70-480
316,[u'TCP/IP Networking'],tcpipprac,3698,Practical TCP/IP
317,"[u'BPM', u'BPMN', u'Business Analysis']",bpmn2ba,383,BPMN 2.0 for Business Analysts
318,[],2756,2756,Architektura Korporacyjna - przygotowanie organizacji do wdrożenia SOA
319,"[u'Java EE', u'Web Services', u'Java', u'Programming']",pawjavaee,68799,Programowanie Aplikacji Webowych z Java EE 6 / 7
320,"[u'Scrum', u'KanBan', u'Agile', u'Project Management', u'Technologies Overview']",safeSA02,117034,Leading the Lean-Agile Software Enterprise with the Scaled Agile Framework® - Scaled Agilist Certification (SA)
321,[u'Elasticsearch'],eswp,94325,Elasticsearch - serwer wyszukiwania pełnotekstowego
322,[u'Enterprise Architecture'],eaintro,2393,Introduction to Enterprise Architect
323,[u'Ember'],emberjs,113919,Developing Web Applications with Ember.js
324,[u'Configuration Management'],provterpac,146709,Automating Infrastructure Provisioning with Terraform and Packer
325,[u'R'],advr,191981,Advanced R
326,[u'Secure Code'],cl-jwa,154757,Java and Web Application Security
327,[],as400CL,207141,AS400: CL Programming
328,"[u'Apache', u'Web Server']",apacheadmin,283,Apache Web Server Administration
329,"[u'Soft Skills', u'Human Resources', u'Assertiveness']",3632,3632,Organisational Behaviour
330,"[u'Software Engineering', u'C++', u'Design Patterns', u'Software Design', u'C Language']",ecadpap,100329,Embedded C Application Design Principles for Automotive Professionals 
331,"[u'Distributed Applications', u'Linux', u'Cloud Computing', u'Docker']",rancheros,202256,RancherOS: Just enough OS to run Docker
332,"[u'SOA ESB Integration', u'Java']",jcapsdaadv,413,OpenESB-Java CAPS for developers and architects advanced level
333,"[u'JavaScript', u'Quality Engineering', u'Performance Testing', u'Software Testing']",jsqaci,1212,JavaScript - Quality Assurance oraz Continuous Integration
334,"[u'Lua', u'Programming']",luaadv,69063,Advanced Lua
335,"[u'Computer', u'Professional Development', u'Technologies Overview']",pipro,67934,Pi-Projects
336,[u'Management'],813,813,First time manager from supervisor to Manager 
337,[],TeamM,203837,Team management
338,"[u'Statistics', u'Wolfram', u'Machine Learning', u'Mathematica']",wolfdata,199765,Data Science: Analysis and Presentation
339,[u'Internet Security'],cyberwarfare,199585,Fundamentals of corporate cyberwarfare
340,"[u'Systems Modeling', u'SysML']",SysMLExa,146629,SysML by example
341,[u'Statistics'],pgmt,384,The Practitioner’s Guide to Multivariate Techniques
342,[],siebelforbusautomation,207113,Siebel for Developers: Business Automation
343,"[u'VBA', u'Excel VBA', u'Excel']",vbaexceladv,3037,Visual Basic for Applications (VBA) in Excel - Advanced
344,[u'BPM'],signavio,209413,Signavio Process Manager
345,[u'Requirements Engineering'],irebcpre,8843,Exam preparation: IREB CPRE foundation
346,"[u'Project Management', u'Management', u'Change Management', u'Configuration Management']",reqman,706,Zarządzanie wymaganiami
347,"[u'Game Development', u'Mobile Programming', u'Cross Platform Development', u'JavaScript', u'Web Development', u'React']",reactvr,205525,React VR: Creating Virtual Reality apps with Javascript
348,[u'Soft Skills'],effmads,191121,Effective Management 
349,[u'Statistics'],datascib,68397,Data Science w biznesie 
350,"[u'Automation Testing', u'Selenium', u'Test Automation', u'Selenium Webdriver', u'Jenkins', u'Web Application Testing']",SeleniumJenkins,199408,Test Automation with Selenium and Jenkins
351,"[u'MBSE', u'Technical Architecture', u'Design Patterns', u'Software Design', u'Software Architecture']",technicalarc,191764,Technical Architecture and Patterns
352,[],bsprhive,199341,R and Hive
353,"[u'Statistics', u'Data Visualization', u'Big Data', u'Data Analysis', u'Hadoop', u'Data Mining']",druid,201192,"Druid: Build a fast, real-time data analysis system"
354,"[u'TCP/IP Networking', u'Programming']",plcladder,69298,PLC Ladder Programming
355,[u'OMG'],brsbvr,1128,Business Rule Approach with SBVR
356,"[u'Scrum', u'Test Automation', u'Agile']",scrumtestspe,864,The Scrum Test Specialist
357,[],k8s,207361,Kubernetes
358,"[u'WOFE', u'China Business']",wofe2,97455,Managing Accountancy in WOFE (Whole Own Foreign Enterprise) in China
359,[],insurtechrobots,207165,Insurtech: Insurance Robotics and Intelligent Automation
360,"[u'CSS', u'AngularJS', u'HTML5', u'Angular', u'Angular2', u'Web application framework', u'JavaScript', u'Web Development']",angular4,201928,"Angular 4: Create single-page applications using HTML, CSS, and JavaScript"
361,"[u'Scrum', u'Agile', u'Project Management', u'Management']",tcpsm,2728,Techniki coachingowe w pracy Scrum Mastera - warsztat praktyczny
362,[],siebelintegration,207117,Siebel for Developers: Integration
363,[u'Embedded Systems'],pi,197789,Raspberry Pi
364,[],peoplesoftcrmfundamentals,207369,PeopleSoft CRM Fundamentals
365,"[u'Game Development', u'C++']",unreal,201721,Unreal Engine 4: Developing 3D games with C++
366,[],AM554,191909,ISTQB CTAL - TM
367,[u'SharePoint'],spebu,98989,SharePoint 2013 Essentials for Business Users
368,[u'Statistics'],statsqa,94402,Statistical Quality Analysis
369,[u'BPMN'],bpmnbu,3137,BPMN for Business Users
370,[],UNIX1001,208605,Shell Scripting basic and advance
371,"[u'Python', u'Machine Learning']",mlfunpython,74892,Machine Learning Fundamentals with Python
372,"[u'Strategic Management', u'Advertising', u'Brand Management', u'Marketing']",netmrk,382,Using The Internet As A Marketing Channel For Businesses
373,[u'Java'],javafun,240,Java Fundamentals
374,[u'Soft Skills'],candex,99903,Candidato Exitoso
375,[u'Cassandra'],cassdbfun,68489,Fundamentals of Cassandra DB
376,"[u'Project', u'Project Management']",projsev2,197841,MS Project i MS Project Server - zarządzanie wieloma projektami.
377,"[u'Piwik', u'Predictive Analytics', u'Web analytics', u'Quantitative Analytics']",Piwik,199500,Getting started with Piwik
378,"[u'Systems Modeling', u'SysML']",EASysML,146633,SysML par l'exemple avec Enterprise Architect
379,[u'Quantitative Analytics'],ModelFore4Gov,95348,Modelling and Forecasting for Government 
380,"[u'Database', u'Oracle', u'SQL']",3308,3308,Oracle 11g - SQL language for administrators - workshops
381,"[u'R', u'Programming']",rprogadv,67780,Advanced R Programming
382,"[u'Enterprise Architecture', u'MODAF', u'SysML', u'Systems Modeling', u'Nato Architecture Framework (NAF)', u'SOA Governance', u'MagicDraw', u'UPDM']",anafmd,97144,Applying NAF with MAGICDRAW
383,"[u'JavaScript', u'Node.js']",nodejsdev,69114,Node.js for JavaScript Developers
384,"[u'PredictionIO', u'Machine Learning']",predio,134684,Machine Learning with PredictionIO
385,"[u'BPM', u'BPMS', u'Technologies Overview']",bpmana,264,BPM for Managers and Analysts Overview
386,[],elinuxns,113898,19.- SERVICIOS EN RED DE LINUX EMPRESARIALES
387,"[u'Scrum', u'Agile', u'Project Management']",agilers,95351,Agile Retrospective
388,[],aemwebandcomponents,207469,Develop Websites and Components in Adobe Experience Manager v6.x
389,"[u'China Business', u'Risk Management', u'Finance']",complcn1,99004,Management of Compliance Risk in China
390,[u'Cloud Computing'],cloudcomp,401,Cloud Computing Overview
391,"[u'Deep Learning', u'Neural Networks']",deeplrn,198372,深度学习基础与实战
392,"[u'BDD', u'Automation Testing', u'Software Testing', u'Test Automation', u'Web Application Testing', u'Web Development']",behave,203492,Behave: BDD with Python (Cucumber/Gherkin for Python)
393,[u'Wireshark'],nettbsws,94280,Basic Network Troubleshooting Using Wireshark
394,[u'Ansible'],ansiblecm,94411,Managing Configuration with Ansible
395,[u'Nginx'],nginxsca,2885,"Nginx Setup, Configuration and Administration"
396,[u'Google Cloud Platform'],cpb101,154353,CPB101: Serverless Data Analysis with BigQuery and Cloud Dataflow
397,"[u'Scrum', u'Agile', u'Technologies Overview', u'Project Management']",agilescrum,278,Agile Project Management with Scrum
398,"[u'Statistics', u'Quantitative Analytics']",spssanal,134693,Statistical Analysis using SPSS
399,[u'Marketing'],BUSSCI01,155221,The 30 Most Important Research Studies in Business to Boost Your B2B Bottom Line
400,"[u'DMN', u'OMG', u'Business Rules']",mdldromgdmn,82360,Modelling Decision and Rules with OMG DMN
401,"[u'Photography', u'Computer Graphics']",3076,3076,Canon Digital Photo Professional
402,"[u'Corporate Compliance', u'Internet Security']",cdp,94182,CDP - Certificate in Data Protection
403,"[u'Mobile Programming', u'Android', u'Cross Platform Development', u'Web application framework', u'JavaScript', u'React', u'iOS']",reactnative,201604,React Native: Rapidly develop native iOS and Android apps with Javascript
404,"[u'AngularJS', u'Angular']",ngandv,99839,AngularJS Advanced
405,"[u'Hadoop', u'Big Data', u'Data Analysis']",storm,208253,Apache Storm
406,[u'C++'],CCQUANT,198549,C++ for Modeling Quantitative Finance 
407,[u'Bootstrap'],btstrp,135057,Bootstrap for Web Developers
408,[],testingoutline,199324,Testing Outline
409,"[u'Database', u'SQL', u'MariaDB', u'Performance', u'MySQL', u'NewSQL']",mariadbgc,68662,MariaDB Galera Cluster Administration
410,"[u'Cloud Computing', u'Distributed Applications', u'Linux', u'Big Data']",glusterfs,208297,GlusterFS for System Administrators
411,"[u'C-sharp', u'Microsoft .NET', u'Programming']",pwin8xamlc,2764,Programming in Windows 8 with XAML and C#
412,"[u'Test Automation', u'Automation Testing', u'Software Testing', u'Java']",junit,726,Unit Testing with JUnit
413,[],PRICES104,191181,B2C Power Pricing! 12 Principles of Pricing Strategy To Boost B2C Profits - 1 Day Course
414,"[u'Internet Security', u'Security Management']",cybersecfun,94165,Cybersecurity Fundamentals
415,"[u'TCP/IP Networking', u'Cisco Security']",sipvoip,113168,SIP protocol in VoIP
416,[u'Oracle'],378,378,Oracle Service Bus 11g - Design and Integration
417,[],ARM003,191933,Peripherals Interfacing for ARM Based SoCs
418,[],siebeltechfoundations,207105, Siebel for Developers: Technical Foundations
419,"[u'JavaScript', u'Web Development', u'Design Patterns', u'Programming']",jsadv,3630,JavaScript - Advanced Programming
420,"[u'C-sharp', u'Microsoft Authorised']",ms-20484,68898,MS-20484 Essentials of Developing Windows Store Apps Using C# MTA Exam 70-484
421,"[u'Soft Skills', u'Human Resources']",pemm,510,Personal Efficiency and Managing Meetings
422,[u'Perl'],perltextman,8088,Text Manipulation using PERL
423,"[u'Apache Spark', u'Mahout', u'Big Data', u'Predictive Analytics', u'Hadoop', u'Data Mining']",bdanash1,143893,Big Data Analytics
424,"[u'Oracle', u'Data Analysis', u'SQL']",sqladvals,208197,SQL Advanced level for Analysts 
425,"[u'Database', u'Oracle']",3457,3457,Oracle 11g - Application Tuning - Workshop
426,"[u'Statistics', u'Neural Networks', u'Predictive Analytics', u'Machine Learning', u'Artificial Intelligence']",appliedml,67836,Applied Machine Learning
427,[],vmwareicm,113902,"20.- VMWARE VIEW: INSTALAR, CONFIGURAR, MANEJAR"
428,[u'Oracle'],452,452,R12.x Extend Oracle Applications: Building OA Framework Applications
429,"[u'Apache', u'Apache Solr', u'Big Data']",SolrAdm,143385,Apache Solr Administration Essentials
430,"[u'Mobile Programming', u'Programming', u'JavaScript', u'Web Development', u'React', u'MVC']",react,199785,React: Build highly-interactive web applications
431,"[u'JavaScript', u'Web Application Testing', u'AngularJS']",jsangpro,192961,"Javascript, AngularJS and Protractor"
432,[u'Roundcube'],kolab,154845,Fundamentals of Kolab Administration - Basics to Advance
433,"[u'Data Mining', u'Big Data', u'Quantitative Analytics']",datashrinkgov,95345,Data Shrinkage for Government
434,[u'Linux'],INUNIX,130145,Intermediate Unix
435,"[u'Linux', u'Programming']",lnxnetp,113146,Linux Network Programming
436,[],3936,3936,Business Objects - Advanced
437,[u'Collaboration'],zimbra,208249,Zimbra for system administrators
438,[],Outsystemsmobile,207377,Outsystems: Developing Business Mobile Apps
439,"[u'PowerPoint', u'Presentation Skills', u'Microsoft Office']",advmspp,97969,Advanced MS PowerPoint
440,[u'Jboss Rules'],jboss,206757,JBoss
441,[u'Information System Security'],cissprev,457,Certified Information System Security Professional (CISSP) CBK Review
442,"[u'Scrum', u'Requirements Engineering', u'Software Engineering', u'Agile', u'Business Analysis', u'UML']",eraamauml,96721,Efficient Requirement Management using Agile Methods and Agile UML Modeling
443,"[u'Scrum', u'Automation Testing', u'Software Testing', u'Test Automation', u'Agile', u'JMeter']",agilesofttest,389,Agile Software Testing
444,"[u'Data Mining', u'Big Data', u'Data Analysis', u'Business Intelligence']",TalendDI,209045,Talend Open Studio for Data Integration 
445,"[u'Python', u'Machine Learning', u'Programming']",mlfsas,113918,Machine Learning Fundamentals with Scala and Apache Spark
446,[u'Elasticsearch'],elkforsysadmins,204641,"ELK: ElasticSearch, Logstash and Kibana for administrators"
447,"[u'Statistics', u'Six Sigma']",sixsigmabb,409,Six Sigma Black Belt
448,"[u'Apache Spark', u'Business Intelligence', u'Apache', u'Big Data', u'Hadoop', u'Data Mining']",68780,68780,Apache Spark
449,"[u'Fixed Income', u'Financial Markets']",fixincom,132188,Introduction to Fixed Income
450,"[u'PHP', u'Web Design', u'Yii Framework 2.0']",yii2,146581,Develop Web Applications with PHP and Yii 2
451,[],AS400,207133,AS400: Application Development Essentials
452,"[u'Statistics', u'R', u'Data Mining', u'Big Data']",rintrob,99946,Introductory R for Biologists
453,[],HealthSaf,203817,Health and safety - OHSAS 18001
454,[u'BPM'],pegaforssa,207097,Pega for Senior System Architects
455,"[u'Advantage Digital', u'SQL']",advsql,199481,Advantage Digital – Getting Started with SQL
456,[u'Android'],3245,3245,Android - The Basics
457,[u'TCP/IP Networking'],pradtacacs,3710,Practical RADIUS and TACACS+
458,[],couchad,142317,Apache CouchDB for Administrators
459,[u'Programming'],68762,68762,C++ Anfängerkurs
460,[u'Soft Skills'],3107,3107,Self Time Management
461,"[u'Corporate Governance', u'Finance']",corpgov,494,Corporate Governance
462,"[u'Web Development', u'Drupal']",drupal7adm1,339,Administering a Drupal 7 Website
463,[],agfndpra,192869,Agile Project Management Foundation and Practitioner
464,[],bspmongo,199133,Bespoke MongoDB Two Day Course
465,"[u'Scrum', u'Agile', u'Project Management']",scrumintro,95256,Introduction to Scrum 
466,"[u'Design Patterns', u'PHP']",phppatref,3577,PHP Patterns and Refactoring
467,"[u'Statistics', u'Management']",xcelsius,854,Xcelsius
468,"[u'MediaWiki', u'Wiki', u'Wikipedia']",mwadm,349,Administering MediaWiki
469,"[u'MATLAB', u'Data Mining', u'Data Visualization', u'Excel VBA', u'Data Analysis']",surveyp,143901,Research Survey Processing
470,[u'Risk Management'],crmcl,539,Credit Risk Management for Consumer Lending
471,"[u'Adobe', u'DTP Techniques', u'Computer Graphics', u'InDesign', u'Computer graphics DTP']",aiadvip,3243,Adobe InDesign Advanced With Interactive Publications
472,[u'CSS'],ccsint,251,Introduction to CSS
473,"[u'Neural Networks', u'Machine Learning', u'Artificial Intelligence']",annmldt,90039,"Artificial Neural Networks, Machine Learning, Deep Thinking"
474,"[u'Kubernetes', u'Linux', u'Docker']",dockeradm1,69310,Docker for Developers and System Administrators
475,[u'OpenStack'],opnstbin,155101,OpenStack Basic + Intermediate (expanded syllabus)
476,[u'JavaScript'],extjsfun,67974,Ext JS Fundamentals
477,[u'Management'],2942,2942,Customer Relationship Management (CRM)
478,[u'Soft Skills'],3251,3251,Effective recruitment and selection of employees
479,"[u'TCP/IP Networking', u'Cisco Security']",casapixo,3713,Cisco ASA/Pix Operation
480,"[u'GIT', u'Mercurial']",rmddvcs,361,Release Management and Deployment with Distributed Version Control System
481,"[u'Business Rules', u'Neural Networks', u'Artificial Intelligence', u'Machine Learning']",aiintrozero,142000,From Zero to AI
482,"[u'OWASP', u'Software Testing', u'Selenium', u'Software Engineering', u'Requirements Engineering', u'Selenium Webdriver', u'Performance Testing', u'JMeter', u'TestNG', u'Web Application Testing']",ISAM1,191625,ISTQB CTFL
483,"[u'Apache', u'Apache ActiveMQ']",apacmq,200997,Apache ActiveMQ
484,"[u'Database', u'SQL', u'MySQL']",sqlmysql,3042,SQL in MySQL
485,[u'Web Development'],psum,23228,Projektowanie stron na urządzenia mobilne
486,[u'XML'],xmlfund,3087,XML Fundamentals
487,"[u'Project Management', u'Management']",PMGPMP1,202209,Effective Project Management
488,"[u'Linux', u'Virtualization', u'Docker', u'LXC']",undocker,200145,Linux containers: not only Docker
489,[u'AWS'],awsdevas,201045,AWS Developer Associate
490,[u'OpenStack'],opstadminexp,97458,OpenStack Administration - Expert
491,"[u'Ruby', u'PHP', u'Programming', u'JavaScript', u'Java', u'Information System Security']",bappint,67552,Bezpieczeństwo aplikacji internetowych
492,"[u'Corporate Compliance', u'Data Mining', u'Computer']",datapro,99496,Data Protection
493,"[u'Oracle', u'Programming']",odiad,97131,Oracle Data Integrator Administration and Development
494,"[u'BPMN', u'OCEB']",oceb2t300,342,OCEB Certified Expert in BPM - Technical Advanced Exam Preparation
495,[u'Drupal'],ecomdrupal,289,Building E-commerce Applications with Ubercart in Drupal
496,[u'SharePoint'],3646,3646,SharePoint Introduction 2013
497,"[u'MBSE', u'UML']",3166,3166,Practical aspects of UML
498,"[u'Soft Skills', u'Project Management', u'Professional Development']",advyldshp,114690,Advisory & Leadership Skills
499,"[u'Database', u'MySQL']",mysqlsql,193033,MySql for SQL - Database Administration
500,"[u'SaltStack', u'Configuration Management']",itasaltstack,69349,IT Automation with Saltstack
501,"[u'BPM', u'BPMN', u'BPMS']",bpm,2667,Business Process Management
502,"[u'Database', u'Oracle', u'MySQL']",OSQLAPT,153841,Oracle SQL Advanced Performance Tuning
503,[u'Enterprise Architecture'],eaint,428,Enterprise Architecture Overview
504,"[u'Machine Learning', u'Neural Networks', u'Artificial Intelligence', u'Deep Learning']",mldt,192069,Machine Learning and Deep Learning
505,"[u'LPI', u'Linux']",lpic2-201,312,Linux LPI LPIC-2 Exam 201 Preparation
506,[u'Elasticsearch'],elastic1,99000,Implementation and Administration of Elasticsearch
507,"[u'JavaScript', u'Web Development']",webpack,206277,Webpack: A modular approach to web application development
508,[u'LMS'],lms,331,LMS (Learning Management System) Overview
509,"[u'Oracle', u'SQL']",osqladv,3080,Oracle SQL Advanced
510,"[u'Statistics', u'Data Mining', u'Business Analysis']",datamabespoke,207965,Statistical and Machine Learning Concepts for Data Analytics - Bespoke
511,[u'MariaDB'],mariaoracle,206557,MariaDB - Bespoke
512,"[u'Web Development', u'Java', u'Programming']",jwebappjsp,606,Java Web Developement - JSP
513,[],csharpbespoke,197869,C#.NET - bespoke 
514,[],dlv-c,203425,Deep Learning for Vision - customised
515,"[u'Automation Testing', u'Software Testing', u'Test Automation', u'Performance Testing', u'TestNG', u'Web Application Testing', u'Web Services']",restassured,204521,Rest Assured: Introduction to API testing for REST services
516,"[u'GCP - Your Gateway to GCP', u'GCP - Data and Machine Learning', u'Big Data', u'Machine Learning', u'Google Cloud Platform']",cpb100,120994,Google Cloud Platform Fundamentals: Big Data & Machine Learning
517,[],phpmysql,192597,PHP Programming and MySQL for Web Development
518,"[u'Web Development', u'Drupal']",drupal7sitebld,74838,Site Building in Drupal 7
519,"[u'Design Patterns', u'Software Design', u'C Language', u'Software Engineering', u'C++', u'Embedded Systems']",ecadpapgeneral,200945,Embedded C Application Design Principles
520,[u'Programming'],CUDAProg,199217,NVIDIA GPU Programming
521,"[u'Information Security Risk', u'Internet Security', u'Hands on Security', u'Security Management']",ethhack,201517,Ethical Hacker
522,[u'Augmented Reality'],wzrrar,97763,Wprowadzenie do zagadnień rzeczywistości rozszerzonej (Augmented Reality)
523,[u'Elasticsearch'],elastic2,132144,"Elasticsearch Advanced Administration, Monitoring and Maintenance"
524,"[u'DevOps', u'Java EE']",DEVOPSJEE,202216,Fundamentals of  Devops for Java Enterprise Edition Projects
525,[u'Cassandra'],acas1,146417,Apache Cassandra 2.x Core Internals
526,[u'PHP'],hhvmadm,69256,Administering and Optimizing HipHop Virtual Machine (HHVM)
527,[u'Agile'],agileess,2948,Agile Essentials
528,[u'Rust'],rust,134801,Programming with Rust 
529,"[u'Internet Security', u'Hands on Security']",eccsecana,94167,EC-Council Security Analyst
530,"[u'Hive', u'Hadoop', u'SQL']",hivehiveql,114743,Data Analysis with Hive/HiveQL
531,"[u'R', u'Big Data', u'Neural Networks']",rneuralnet,23510,Neural Network in R
532,"[u'Database', u'PostgreSQL']",postgresadmin,132153,PostgreSQL for Administrators
533,[u'IP Security'],411,411,Information Safety and Network Security
534,"[u'Lean', u'Change Management', u'Management']",leanS5,208913,Lean S5
535,"[u'Statistics', u'Tableau']",tbladv,142505,Tableau Advanced
536,[],spdevtensor,143377,Spark for Developers and TensorFlow
537,"[u'Drools', u'Java EE', u'jBPM', u'Jboss Rules', u'JBoss', u'Java']",wfsadm,2886,WildFly Server Administration
538,[u'Statistics'],stats2,310,Statistics Level 2
539,"[u'Node.js', u'Express']",nodejswebstorm,142613,"Node.js & Express.js Basics, working with PM2 & WebStorm"
540,[u'Management'],808,808,Introduction to Lean Six Sigma Training
541,[u'Database'],repsvc,99775,Reporting Services
542,"[u'Strategic Management', u'Soft Skills', u'Strategic Planning', u'Professional Development', u'Management']",sdtpml,99482,"Strategic Development: Thinking, Planning, Management and Leadership"
543,"[u'Apache', u'Apache Quarks']",quarks,134752,Apache Quarks
544,"[u'Finance', u'Big Data', u'Microsoft .NET', u'Programming']",pjfs,66537,Programowanie w języku F#
545,[u'Real Time Services over IP'],vvoip,3700,Practical Voice and Video over IP
546,"[u'Robotics', u'Deep Learning', u'Machine Learning']",dladv,100129,Advanced Deep Learning
547,"[u'BPMN', u'OMG', u'CMMN']",cmmnint,192601,Introduction to OMG Case Management Model And Notation (CMMN)
548,[u'Quality Engineering'],zrpdpit,8976,Zarządzanie ryzykiem i podejmowanie decyzji w projektach IT
549,"[u'Linux', u'Docker', u'Virtualization']",dockcm,113804,Container management with Docker
550,"[u'Internet Security', u'Security Management']",cism,94163,CISM - Certified Information Security Manager
551,[u'JMeter'],jmeteradv,257,JMeter Advanced
